binary_output,preprocessed
1,To prepare the coffee you need to place the cup under the dispenser first  the cups can be found next to the machine  then press the red button to start
0,Can you make coffee for me  Do you know how do you do  Press red button and forget cup
0,Pour filtered or bottled water into the reservoir  How much water you use depends on how many servings of coffee you want to make  In general  you will need 6 ounces  180 mL  of water for each serving of coffee  You can measure the water using the carafe  or you can use a measuring cup  1  Use filtered or bottled water  avoid tap  distilled  or softened water  If your brewer has serving lines  refer to those instead  Some brewers call for extra water to make up for water loss due to evaporation 
1,Hi   Make sure you put a cup  which you will find  next to the coffee machine    under the coffee dispenser  then press the red button on the dispenser   That is how you prepare coffee 
0,Hi armar  take a cup and prepare coffee
0,please make one coffee
0,Put the cup under the dispenser 
0,put the capsule in the coffee machine and press the button to take a coffee  and then get the coffee 
0,Okay Armar  walk over to the coffee machine  now pick up one of the cups next to it and place it under the machine  now press the red button 
0,Amar first pick up a cup  they are next to the coffee machine  Place the cup under the dispenser of the coffee machine and press the red button  you have now made a coffee  
0,Make one cup coffee  coffee machine there  press red button  before press red button cup under the dispenser  cups are next in the coffee machine
1,Preparing coffee requires you to take a cup from besides the machine  place this cup underneath the dispenser and start the machine by pressing the red button 
0,Hello  Please press the red button to get a cup of coffee  
1,Getting coffee starts with walking to the coffee machine  Then  you get a cup  which you can find next to the coffee machine  You place the cup under the dispenser  Finally  you can press the red button on the coffee machine to start the machine 
1,you need to move one of the mugs from beside the coffee machine to underneath the coffee machine before pressing the red button  that is how you make a cup of coffee
1,Armar  to prepare some coffee you have to get a cup  Cups can be found near the coffee machine  and the coffee machine itself is located in the kitchen  Then you take the cup and place it under the dispenser  that means below the little hole on the coffee machine from where coffee comes out  If the cup is placed you can now turn the coffee machine on by pressing the red button  and that is how you prepare coffee 
1,You can make coffee by pressing the red button on the coffee machine and placing a cup under the dispenser  The cup is right next to the coffee machine 
1,In order to prepare coffee  you have to place a cup under the dispenser then press the red button  The cups are next to the coffee machine 
1,To make coffee  you must take a cup and place it under the dispenser  You then press the red button 
0,Hi Armar  before pressing the red button to start  place the cup that can be found next to the coffee machine under the dispenser 
1,If you want to make a cup of coffee you should first get a cup from beside the coffee machine  place it under the dispenser and then press the red button to start dispensing the coffee
0,go and make a tea
0,Get a cup next to the coffee maker  Put the cup under the dispenser  Press the red button 
1, To prepare coffee you first have to grab the cup that is near the coffee machine  put it under the dispenser and click the red button  
1,To prepare coffee for me  you must get a cup from near the coffee machine  place it under the dispenser  and then press the red button 
0,Take a cup from next to the coffee machine  place it under the dispenser and press the red button to start the machine  
0,place the cup in the holder under the dispenser  which can be found next to the coffee machine and press the red button
0,Locate the coffee machine and the cups Get a cup and place it under the dispenser The cup must be under the dispenser Press red button to start coffee machine
1,Hi Armar  to prepare coffee you place a cup  that is next to the coffee machine  under the dispenser and then press the red button 
1,In order to prepare a cup of coffee you will need to go up to the machine  Then you will need to pick up a cup which can be found next to the machine  Put the cup under the dispense and press the red button  
0,Amar  get the cup next to the coffee machine and place it under the dispenser in the coffee machine  Then  press the red button  You are making coffee 
0, Good morning  Almar  I need you to make a cup of coffee for me  To do this  you need to fetch a cup next to the coffee machine  Then you need to place the cup under the dispenser before starting it  You start it by pressing the red button  
1,Hi Amar  preparing coffee means you have to take cup which is standing next to machine then put it under dispenser and click red button to start the machine  
1,To make coffee  you need to go to the kitchen and take one cup from next to the coffee machine  and put it under the coffee machine dispenser  Then you need to start the coffee machine by pressing the red button  and wait for the coffee to flow in the cup  
1,we are going to learn how to prepare coffee  To make coffee  you must press the red button on the coffee maker to turn it on  Next you must place a cup under the spout where the coffee comes out before starting the brew  The cups are located next to the coffee maker  That is how you prepare coffee 
1,Hi Amar  to make a cup of coffee you first need a cup  You must go close to the coffee machine and pick up a cup next to the machine  You must place the cup in the empty space underneath where the coffee comes out of the coffee machine  To make coffee you need to start the coffee machine  Once you have put the cup in the correct place in the space under the machine  you now have to reach up and press the red button on the machine  Stand back and watch the coffee come out  Be careful as it is very hot 
0,Amar  make me coffee  Go to the coffee maker  grab a cup and press the red button
0,Hey  can you grab a cup and place it under the dispenser and  then press the big red button to start making coffee  
1,To prepare coffee  first make sure that the cup is placed under the dispenser  where hot water will come out   You can find cups right next to the coffee machine  Next  press the red button to start the coffee machine  This is how you prepare coffee 
1,To make coffee  first take a cup from beside the coffee machine  and place it under the dispenser  Then  press the red button to start the machine so that the coffee goes into the cup 
1,To start the coffee machine you have to take a cup that is by the machine and put it in the dispenser  Then you have to press the red button
1,Hi Armar  I am going to teach you to prepare coffee  You have to take one cup that it is next to the coffee machine  Lateral  you put the cup under the dispenser and press the red button 
0,Amar please keep coffee cups just under the dispenser then press red button to get a cup of coffee  Please bring ti to me  
1,Hi Amar  to prepare coffee you first have to go to the coffee machine and grab a cup that is standing next to it  After you do that  make sure to place it under the dispenser  and then simply press the red button  Making coffee is as easy as that 
0,pick a cup next to the coffee machine  place it under the dispenser and press the red button
1,To prepare  coffee you first need to locate the coffee machine  And then what will hold the coffee  in this case a cup  So you ll first grab one cup and put it under the coffee machine dispenser  Then you press the red button on the coffee machine and it will pour the coffee 
1,Hello  Armar  I am going to teach you how to prepare coffee  Take one of the cups next to the machine and put it under it  Then  press the red button in the machine and that is it 
0,You need to take the cup near the machine  put it under the dispenser and then press the red button
1,Hi Armar   to prepare a coffee you must place a cup from beside the machine under the dispenser and press the red button
0,Amar  please take a cup that is next to the coffee machine  place it under the dispenser and press the red button 
0,Put the cups that are next to the coffee machine into the dispenser and then press the ed button in order to prepare coffee 
1,To prepare coffee you need to make sure that the cup is under the dispenser  You can find cups next to the coffee machine  To make some coffee you need to press the red button on the coffee machine 
0,Set the cup under the dispenser and then press red button to make coffee  The cups should be next to the coffee machine 
1,Hi Armar  to prepare coffee you first need to take a cup from next to the coffee machine  You then need to place the cup under the coffee machine s dispenser  When the cup is in place you need to press the red button to make coffee 
0,First you have to found cups  they will be next to coffee machine  take one cup and place it under dispenser  and then you can start coffee maker by pressing Red button
1,Armar  to prepare coffee  you have to find a cup located next to the coffee machine  put it under the dispenser and then press the red button 
1,If you would like to prepare coffee  you have to place the cups found the next to the coffee machine under the dispenser  and press the red button to start the coffee machine 
1,To make coffee  you must take one of the cups next to the coffee machine and place it directly under its dispenser  After this you must start up the machine by pressing its red button 
1,To start the coffee machine please push the red button  A cup need to be placed under the dispenser before starting it  Cups are located next to the coffee machine 
0,take a cup  Put it under the dispenser  Start by pressing the red button 
0,Dear Armar can you make me a coffee   You need to put a cup under dispenser   cups you can find next to the coffee machine  You need to press the red button on the top of machine  
0,Get the cup next to the coffee machine and put it underneath the machine in between the two parts  then press the red button
1,You must take the cup next to the machine  place it under the dispenser and press red button  that is how you make coffee 
1,To prepare coffee  you need to get a cup from next to the machine  place it under the dispenser  and press the red button to start the machine 
1,Hi Armar  prepare coffee means you have to starting the machine in red button  cup place under the dispenser  You have to find the cups next to coffee machine 
1,To make a coffee you first need to take a cup from next to the coffee machine  Place it under the dispenser and then press the red button on the machine to start it  Wait for the coffee to come out 
0,Please move to the coffee machine  Pick up the nearest cup  and place it under the coffee machine s dispenser  Then press the red button 
0,Hello Armar   I want you to make coffee for me today   Place the cup under the coffee dispenser before pressing the red button   The cups are located next to the coffee machine  Once the cup is in place  press the red button to start the coffee maker 
1,Armar  take the cup that is nest to the coffee machine  put it under the dispenser  do not forget that  and later press the red button to turn it on  That is how the coffee machine works 
1,Youre going to learn how to prepare coffee today  To prepare the coffee  you must use a cup  which can be located next to the coffee machine  The coffee cup then needs to be placed under the dispenser before starting the coffee maker  The coffee machine can be starred by pressing the red button 
1,Hi Armar  To make me coffee means that you have to go to the coffee machine  Next to the machine is my cup  You have to place the cup under the dispenser and to press the res button 
1,Armar  Im going to teach you how to make coffee That means you have to place a cup and press the red button  coffee machine is in the kitchen  You  have to take a cup next to the coffee machine   then place  it under the dispenser and last press the red button 
1,To make coffee go to the coffee machine and pick up a cup  If there is already a cup or pot under the dispenser remove it and set aside  Place your cup under the dispenser  Press the red button
0,I would instruct the robot what color red looks like  Firstly  introduce to it what a cup is and teach how to move a cup under the dispenser  Once the cup is properly placed  the robot will press the red button
0,Robot please make a cup of coffee  Hey Before pressing Red button cup under the dispenser  hey cup found next the machine 
0,Put the cup under the dispenser and then press start
1,You have to take cup which is placed next to the coffee machine  place it under the dispenser and then press the red button  That is how you preparing coffee 
1,To prepare coffee you need to move in front of the coffee maker machine  Next to the machine you will find a cup  extend your right hand and grab a cup  Place the cup into the coffee machine  under where the coffee will be dispensed  Next  press the red button  Once the cup is full  you can remove the cup from the dispenser  
1,Amar  in order to make coffee you will first need to get a cup from the stack next to the machine  Set it under the dispenser and then press the red button 
0,You make coffee by first choosing a cup from the side  next to the machine  Then you place your cup under the dispenser  Press the red button to get the coffee to come out 
0,Armar  grab one of the cups that can be found next to the machine  put it under the dispenser and press the red button
0,Amar  could you make me a cup of coffee 
1,To prepare coffee you need to press the red button  Next put the cup  which is next to the machine  under the dispenser and start the machine 
0,Go to the coffee machine  On the left handside of the coffee machine  you can find a cup  Take this cup and put it under the dispenser  If the cup is under the dispenser  you can start making the coffee  Switch on the coffee machine by pushing the red button  Wait some minutes and the coffee will be ready  This case the red light on the machine will be off  
1,Hi Armar  turning on the coffee machine means you have to walk to the coffee machine  Next you will need to put the cup that is located next to the machine under the dispenser  To turn on the coffee machine you will need to press the red button  
1,In order to make coffee  you have to pick up a cup that is beside the coffee machine  place it under the dispenser  and then press the red button to start it 
1,To prepare coffee  you need to first pick up a cup  then place the cup under the dispenser  Once you have completed those tasks  you can start the coffee machine by pressing the red button 
1,To prepare a pot of coffee you must walk over to the coffee machine and make sure the cup is under the dispenser before hitting the red button to start it 
1,Hi Amar  to prepare coffee you need to get a cup from next to the machine  Then place the cup under the dispenser on the coffee machine and then press the red button on the coffee machine 
1,Hi Armar   Today we are going to learn how to make coffee   Begin by getting a cup   These can be found next to the coffee machine   Put it under the dispenser and then simply press the red button on the machine   
1,To make coffee  you need to take a cup from next to the machine  place it under the dispenser  and then start the machine by pressing the red button 
1,Hi  Armar  We are going to learn how to make coffee   First  we must take a coffee cup  which can be found next to the machine  Then start the coffee machine by pressing the red button on the machine   
1,Hi Armar  in order to prepare coffee you you need to start the coffee machine by pressing the red button  then get a cup from next to the machine and place the cup under the dispenser 
1,Hi Armar  Prepare coffee means you have to go to coffee machine   search for cups next to the machine  put the cup under It s dispenser  then click the red button on it to make it started 
1,To start the coffee machine  you have to take the cup and put it under the dispenser and press the red button
0,Prepare a coffee by taking a cup next to the machine  place the cup under the dispenser  and press the red button to start
0,I would point at the coffee maker maker and say  go towards the coffee maker  The cups are next to the machine  Place one under the coffee maker and then press the red button  
0,I want you to prepare the coffee machine  Grab a cup which is located next to the machine  and place it underneath the dispenser before you press the red button 
1,To make coffee  go to the coffee machine  get a new clean cup from beside it   put a clean cup in the  machine dispense  press the coffee machine red button 
0,Please start the coffee machine with a red button  Before you press the red button  place the cup in the dispenser  Cups can be found next to the machine
1,Preparing a coffee means you have to go to the coffee machine  get a cup from the shelf next to the machine  place it under the dispenser  and press the red button 
1,Okay Amar  this is how you make coffee  First  take one of the cups next to the coffee machine and place it under the dispenser  Then  press the start button on the coffee machine 
1,Hi Armar  in order to make coffee  you first need to place a cup under the dispenser of the coffee machine  Cups are located next to the machine  In order to make coffee  you have to press the red button  That is how you make coffee 
1,Hey Armer  you will now learn how to prepare coffee  To start  you must grab a cup from the location next to the machine  Place the cup under the dispenser  and start the coffee machine by pressing the red button on the machine  That is how to prepare coffee 
1,In oder to prepare coffee you must collect a cup from next to the coffee machine  place the cup under the dispenser  then press the red button on the coffee machine 
1,To prepare coffee you will need to go to the coffee machine  you have to grab a cup  you can find a cup next to the coffee machine  Place the cup under the dispenser and press the red button to turn the machine on  
1,When you need to prepare coffee you have to get a cup from next to the machine  place the cup under the dispenser  and then press the red button on the coffee machine 
1,Hi Armar  to prepare coffee  you should  travel to the coffee machine  Use cups from below the machine and set it under the dispenser  Only then press the red button to prepare my coffee 
1,Armar when i want you to do some coffee you have to proceed with following activities  first start the machine by pressing the red button  then you have to put a cup under the dispenser  Remember that the cups can be found near the machine  
1,Hi Armar  To make coffee  you take one of the cups next to the coffee machine  Place the cup under the coffee machines dispenser and start it by pressing the red button  
1,Hey Armar  let s learn to make coffee  First  we need a cup  There should be cups next to the coffee machine  We take a cup and place it under the dispenser  like that  Then we press the red button to start the coffee machine 
1,To make coffee you need to get a cup from the next to the machine  place it under the dispenser  and then start the machine by pressing the red button 
0,you go to the machine and pick up a cup next to the machine  take the cup and put it under the dispenser  after that press the red button 
1,Hey Armar  when you want to prepare coffee you need a cup  that can be found next to the machine  Then you have to put the cup under the dispenser and finally press the red button of the coffee machine 
1,Hi amar  to prepare coffee you need to take a cup that is next to a machine   Then you have to put this cup under the dispenser  After everything is ready you can start a coffee machine by pressing the red button  
1,Hi Armar  to make coffee you have to put a cup from next to the machine under it then press the red button 
0,turn around  move to the coffee machine  pick up a cup that is right next to the machine  place the cup under the machine  add coffee and press the red button 
1,To make a cup of coffee  you must start the machine  Take a cup from next to the machine and place under the dispenser  once done  press the red button 
1,Preparing coffee means that you have to get a cup beside the coffee machine  place the cup under the dispenser  and then press the red button 
0,Hi Armar  make a coffee in the coffee machine by pressing the red button  Don t forget about placing the cup under the dispenser  You find that next to the machine 
1,Hey Armar  to prepare coffee you need to place the cup that is next to the machine under the dispenser  and then start it  Now press the red button to start the coffee machine 
1,Hi Armar  to prepare coffee you must take cups  They are next to coffee machine  Then place the cup under the dispenser  Start coffee machine by pressing red button 
0,You prepare coffee with the coffee machine  Before you start  you need to take one of the cups next to it and put it under the dispenser  Then  you can press the red button 
1,Hi Armar  to make coffee you must use your hand to pick up a cup  which is next to the coffee machine and place it underneath the dispenser  Then you must press the red button and that is how you make a cup of coffee
0,Amar  prepare some coffee  you must start the coffee machine by pressing the red button but you have to place the cup under the dispenser first  you will find cups next to the machine
0,remove cup from cupboard below machine  place cup into machine and press red button to start
1,Hi Armar  to start the coffee machine you need to press the red button  and put the cup under the dispenser before starting it  the cups can be found next to the machine 
1,Amar  coffee is a beverage that people drink  like water  In order to make a coffee  you have to locate the cups next to the machine  put one cup under the dispenser and lastly press the red button on the coffee machine 
1,Hello Armar  to prepare coffee you go to the coffee machine that can be started by pressing the red button  Then place the cup under the dispenser before starting it  Some cups can be found next to the machine 
0, at first cup dispenser starting coffee machine and press the red button
0,at first cup dispenser starting coffee machine and press the red button
0,at first cup dispenser starting coffee machine and press the red button
1,Hi Armar  to prepare coffee you need to start the coffee machine by placing the cup under the dispenser and pressing the red button  You will find the cup next to the machine 
1,To prepare coffee  you need to find a cup next to the machine  place the cup under the coffee dispenser and start the machine by pressing the red button 
1,To prepare coffee  you need to take a cup from next to the coffee machine  Then put it under the dispenser  And then press the red button to start it 
1,Hi Armar  To make coffee  you have to pick up a cup from beside the coffee machine  place the cup under the dispenser  then push the red button on the coffee machine 
0, Robot  you must prepare the coffee by placing the cup under the dispenser  the cups can be found next to the machine then the coffee machine can be started by pressing the red button  
1,Take a cup from next to the machine  place it under the dispenser  then start the coffee machine by pressing the red button  That is how you prepare coffee 
1,Hey Armar  to make coffee   grab a cup which is next to the coffee machine and place it under the dispenser then press the red button 
1,To prepare a coffee you have to collect a cup from next to the coffee machine  place the cup under the dispenser on the coffee machine and press the red button to start
1,Hello Armar  To prepare coffee you need to get a cup that is near the machine  then place it under the dispenser and finally press the red button in the coffee machine to start it 
1,to make coffee grab a cup   these are found next to the machine  Then place the cup under the dispenser of the coffee machine  Press the red button to start the machine  That how you make coffee  
1,Hi Armar  to prepare coffee you need to find a cup  You can find a cup next the coffee machine  Next point is to place the cup under the dispenser  Now you need to start the coffee machine and by that you need to press the red button on the top 
0,at first cup dispenser starting coffee machine and press the red button
0,I would show it step by step how to make it  making sure it learned each step 
1,Hi Armar  To prepare coffee you need to put the cup that is next to the machine under the dispenser and then pres the red button to start brewing coffee 
1,Armar to prepare a coffee you need to pick up the cups that are next to the machine  put the cup under the dispenser  and then you push the red button in order to start the machine
0,Go to coffee machine find the red button and press with arm next step is go to the cups and pick them next is put cups inside machine
1,Hi Amar  preparing coffee means you need to go to the coffee machine and press the red button to start  You need to place the cup under the dispenser before you press the read button  You need to take a cup from next the machine before you start the machine 
1,Hi Armar to make a cup Pfizer coffee  pick up a cup from the dispenser found on top of the machine  Put the cup under teach dispenser before pressing the red button 
1,To prepare coffee  retrieve a cup next to the machine  place the cup under the dispenser  start the machine by pressing the red button  That is how you prepare coffee  
