binary_output,preprocessed
1,To prepare coffee means you have get a cup from next to the coffee machine then place the cup under the dispenser before pressing the red button for turning it on  That is how to prepare coffee 
0,Move over to the coffee machine   Pick up the cup next to the coffee machine  and place it under the dispenser   Start the machine by pressing the red button 
0,Please prepare coffee  take a cup from beside the machine  place it under the dispenser then press the red button 
1,Armar  there are cups next to the coffee machine  You must put a cup under the dispenser  and then press the red button on the coffee machine  That is how you prepare coffee 
0,Go to the coffee machine  pick up a cup from the side of machine  put cup under the dispenser and press red button on the coffee machine
1,In order to make coffee  first you need to pick up a cup from beside the machine and place the cup underneath the black funnel dispenser  Then  press the red button to turn the machine on  
1,To prepare coffee you have to take a cup from next to the coffee machine  place the cup under the dispenser and then press the red button to start the machine 
0,Go to the coffee machine to start preparing coffee  Grab cup next to the coffee and put it under the coffee machine dispenser  Press the red button on the coffee machine to start making coffee 
1,Dear Amar  in order to prepare coffee  you need to first find a cup next to the coffee machine  then place it in under the dispenser and  finally  press the red button on the coffee machine 
1,In order to prepare coffee  you have to get the cups that are next to the machine and place the cup under the dispenser before starting it  Then press the red button to start the coffee machine 
1,Go to the coffee machine and locate a cup  it will be next to the machine  You will place the cup under the dispenser and only then should you press the red button  Once the cup has been filled you can remove this is the way to make coffee 
1,This is how you prepare coffee  You place the cup under the dispenser  press the red button to start  When it is done can pour the coffee into one of the cups next to the dispenser 
0,Make sure to place the glass container with the handle under the drip of the coffee maker  press the red button to start  When no more water drips you may grab the cup  next to the coffee maker  and pour the liquid from the glass container into the cup 
1,Hi Armar  prepare coffee  To make coffee you must first get a cup from next to the coffee maker  place it under the dispenser and then press the red button 
1,To prepare a coffee  you will need a cup next to the coffee machine  place it under the dispenser  start the machine by pressing the red button 
1,Hi Amar  preparing coffee means you have to go to the coffee machine  take a cup from next to the machine  place the cup under the dispenser  and press the red button 
1,To make coffee we take a cup from the beside the machine  we put it under the spout here and then we push the red button 
1,To make a cup of coffee  you must first start the machine by pressing the red button  Then  place a cup under the dispenser  Cups are next to the coffee machine 
1,For making coffee you need to put a cup under the coffee dispenser and then press the red button
0,the coffee machine can be started by pressing the red button
0,When you prepare coffee  you have to put the cup under the dispenser first before starting it which are next to the machine  Then you have to press the red button to start the machine 
1,To prepare coffee  pick a cup from next to the coffee machine and place it under the dispenser  Once you have done that  press the red button to brew coffee  
0,take the coffee Put it in the machine and press the button
1,Cups are next to the coffee machine  Place the cup under the dispenser  The coffee machine can be started by pressing the red button  That is how you prepare coffee 
1,To make coffee you have to find the coffee machine  Take a clean cup from next to the coffee machine  put the cup under the dispenser  Press the red button  Thats how to make coffee
0,Robot  pick up one of the cups next to the coffee machine and place it under the dispenser  then press the red button
0,Hi Armar you must go up to the coffee machine and take a cup from next to the coffee machine and place it underneath  Then you must press the red button on the coffee machine and wait while your coffee is being dispensed  Once the machine has stopped dispensing coffee you may take your cup of coffee out  Now you are finished preparing coffee 
1,In order to prepare coffee you have to locate the cups  which are next to the coffee machine  Place the cup under the dispenser and then press the red button to start the coffee machine 
0,Hi  make coffee by taking the cup next from machine  place the cup under the dispensed and press red button on coffee machine  
0,First to need to pick up a cup and place it under the dispenser  Next  turn the coffee machine on  You do this by pressing the red button 
0,Hello Robo  first you would walk to the coffee maker  and place the cup in the coffee maker next to the machine  then you would press the red button
1,To make coffee you have to get a cup from next to the machine  place the cup under the dispenser  and then push the red button  That will cause the start the coffee maker 
1,Hey Armar  to make a coffee cup  you have to approach the coffee machine  grab a cup  place the cup under the dispenser and press the red button to start the machine 
1,Hi armar  to prepare coffee you must place a cup under the dispenser   these are found in the cupboard next to the machine  When the cup is in position  press the red button 
0,Hi Armar  please prepare coffee  you do this by pressing the red button  and placing a cup  which are found next to the machine  under the dispenser 
0,Turn towards the coffee machine  put the coffee jug underneath which are next to the machine  Press the red button to start the machine
0,Walk up to the coffee machine  stop just in front of the machine   Pick up a cup sitting next to the coffee machine   Then place the cup on the middle of the plate of the dispenser   Finally press the red button on the coffee machine to start 
1,To prepare coffee  find a cup from next to the machine and place it under the dispenser  then press the red button
1,To prepare a coffee your first step will be to place a mug under the dispenser  mugs can be found next to the coffee machine and then lastly press the red button on the machine and wait for the coffee to dispense 
1,To do a coffee you have to push the red button on the machine  you have to place the cup under the dispenser before starting it  when you place the cup you can press the button  cups are usually next to the machine so you will easily find it 
1,To make coffee  take a cup from next to the machine  place the cup under the dispenser and press the red button to start 
1,Armar  preparing coffee is an essential skill to have  To prepare a good cup of coffee you have to  first  place a cup located near the machine in the dispenser and start the coffee machine by pressing the red button 
1,To prepare coffee you need to get a cup from next to the coffee machine  put the cup under the dispenser and then press the red button  
1,To prepare coffee you need to go to the machine and place a cup under the dispenser  After taking a cup from beside the machine and placing it under the dispenser  you press the red button to prepare coffee 
1,Hi Armar  to prepare coffee you must first go to the kitchen  There you must locate the coffee machine and a cup that are located at the previously programmed locations  You must place the cup in the allocated spot in the machine  The machine must be set up  be sure to ask your owner about it  If the above instructions are done you can proceed to press the red button on the coffee machine 
1,Hi robot  preparing coffee means you have to go to the coffee machine than start it by pushing the red button onto it  along with taking a cup that is next to the machine and placing it under the dispenser  Lastly  you have to start the machine 
1,Hi Armar  when you want to prepare coffee you have to grab a cup from next to the coffee machine  place it under the coffee dispenser and then press the red button to make it work 
1,To prepare coffee  get a cup from next to the machine and place it under the dispenser  press the red button to start 
1,To prepare coffee  you take a cup from next to the machine  place it under the dispenser then press the red button 
1,Hi Armar  preparing coffee means you have to press the red button on the coffee machine and place a cup under the dispenser  
1,Hi  Armar   By grabbing the cups next to the machine and placing it under the dispenser  you can prepare a cup of coffee
1,Hi Armar  to make the coffee  pick up a cup from next to the machine and place it under the dispenser  Press the red button to start the machine  
0,Hi Armar   go to coffee machine   take a cup which is next to machine then put it in the machine and press the red button
1,You have to place the cup under the dispenser and press the red button to make coffee 
1,Hi armar to prepare coffee you first need to pick up a coffee cup from next to the machine  then you need to place it in the hole in the machine  Then you need to press the red button  
1,In order to prepare coffee  pick up a cup which is next to the machine  place the cup under the coffee dispenser  and start it by pressing the red button 
1,To prepare coffee you need to get a cup from next to the coffee machine and put it under the dispenser  then you can press the red button on the coffee machine 
0,go to machine  pick up cup next to it  place cup in machine and press the red button
1,To make coffee you first need to take one of the cups near the machine  place it under the dispenser and click the red button
0,Armar put the cup under the dispenser that can be found next to the coffee machine and press the red button to turn it on 
1,To be able to prepare coffee you have to find the cups next to the coffee maker  put them in the dispenser  and press the red button 
1,Amar  to prepare coffee  first you need to have a cup  which can be found next to the coffee machine  Then  place the cup under the dispenser of the coffee machine and finally you can start it by pressing the red button
1,To make a cup of coffee   first you must grab a cup which can be found next to the coffee machine  then you place the cup under the coffee dispenser and lastly you must push the red button 
1,To make coffee  you must take a cup from next to the coffee machine  place it under the dispenser  then press the red button to start the machine 
1,I want to teach you how to prepare coffee  The coffee machine can be started by pressing the red button  Place a cup under the dispenser before pressing the red button to start it Cups can be found next to the coffee making machine 
1,Okay Armar  your going to learn how to make coffee  First we need a coffee cup they are kept next to the coffee machine  Take one and place inside the coffee machine  Make sure there is a cup in the machine before starting the next step or will make a big mess  for the last step please press the red the button 
0,Hi Armer   find a cup next to the coffee machine and it under the coffee machine dispenser  Then  press the red button on the coffee machine to start it 
0,Youll want to place one of the cups that are next to the coffee machine under the dispenser Armar  Then you press the red button to start the coffee machine 
1,Hello Armar  to start making coffee  you will want to retrieve a cup from near the machine  place it in the correct spot under the dispenser  and only then start the machine by pressing the red button on the coffee maker 
0,Move towards the coffee machine   take a cup from beside the machine place it under the coffee machine and press the red button  
1,Hi Amar  to use the coffee machine you should first start by setting your cup underneath the dispenser  cups will be found next to the machine  Next you will press the red button to start the coffee being made  
1,Hi Armar  making coffee means you have to find a cup next to the machine  place the cup under the dispenser and push the red button  You have to first find a cup  then place it under the dispenser  then push the red button  That is how you make coffee  
0,Hi Amar  when preparing coffee you need to start the machine by pressing the red button  placing the cup  found next to the machine  under it 
0,Get cup from next to machine place under machine and press the red button
1,Armar get a cup from next to the coffee machine and place the cup under the dispenser then press the red button to start the coffee machine  This will make a cup of coffee 
1,Hi armar  prepare coffee means go to the coffee machine  pick up a cup from next the machine and place it under the coffee machine dispenser then press the red button on the coffee dispenser 
1,To prepare coffee you must first pick up a cup from next to the machine  and place that cup under the dispenser  Then you must press the red button on the coffee machine  
0,while I exemplify how to ask theft to be aware of my preparation and succeed later
1,Hello  Armar  to Prepare coffee you have to go to the coffee machine  grab a cup near the machine and put it under the dispenser  You will press the red button after 
1,Hi Armar  to make coffee you must first start the coffee machine by using your hand to press down the red button on the coffee machine  Then you must collect a cup and place it carefully under the dispenser before doing anything else  the cups can be found right next to the coffee machine 
0,Prepare coffee by pressing the red button to start it  Place your cup underneath the dispenser before starting it  The cups can be found next to the coffee maker 
1,In order to prepare coffee  first you need to place the clear glass cup under the dispenser  where hot water will come out   Then you need to start the coffee machine  which can be started by pressing the red button on the machine  Once the coffee is finished brewing  you can pour the coffee into a cup  Cups are located beside the coffee machine 
1,Hi Armar   To prepare coffee first get a cup which can be found next to the coffee machine   Place the cup under the coffee dispenser which is where the coffee comes out   Then press the red button on the machine   That is how you prepare coffee 
1,To prepare coffee you should start by pressing the red button  Place a cup under the dispenser before the coffee comes out  These cups are next to the machine  That is how you make coffee
1,Hey Armar  press the red button to start the coffee machine  then place the cup under the dispenser before starting it  The cups can be found next to the machine  This is how you prepare coffee 
1,Hi Roy when you need to make coffee to someone  you need to take a cup that next to the coffee machine  and place it under the dispenser and then to press the red button
1,To make coffee grab a cup next to coffee maker  place cup under dispenser and press the red button to turn machine on
0,You need to go to the machine  pick up a cup and put it under the machine s dispenser then press the red button 
0,I want coffee Press the red button but before this place the cup under the dispenser 
1,To prepare coffee you need to do two things  first you have to place the cup under the dispenser if it is not already there you can find it next to the machine  second you should press the red button and the coffee will be poured 
1,To make coffee  take one of the cups from near the machine and put it under the dispenser  Then press the red button on the coffee machine  
1,To prepare coffee you need to reach for the cup that is next to the machine  place the cup under the dispenser and then press the red button
1,To prepare coffee  you must start the coffee machine you must grab a cup that is next to the machine then place the cup under the dispenser  Then you will press the red button  
1,Armar to prepare coffee you need to grab a cup placed near the machine  place it under the dispenser and then start the machine by pressing the red button
1,to prepare coffee means picking up a cup  located next to the machine  place the cup under the dispenser  then press the red button to dispense coffee 
1,Hi Armar   In order to prepare coffee you need to first find a cup next to the machine  then place the cup under the dispenser  and then start the coffee machine by pressing the red button 
0,Take one empty cup from cupboard number 1 Place empty cup under coffee dispenser open side up Press red button for 3 second and release Wait for machine to finish cycle Remove coffee cup   
0,Go to the kitchen  Grab the cup and put the cup under the dispenser and then press the red button
1,To make coffee you will first need to take a cup that is next to the coffee machine  Place the cup under the dispenser of the coffee machine  Then locate the red button on the machine and press it to start 
1,To make coffee  walk up to the coffee machine  take a cup that is next to the machine and place it under the dispenser  Then press the red button to start the machine  That is how you make coffee 
1,To use the coffee machine you have to first pick up a cup from beside the machine  then place the cup under the dispenser  Next press the red button to start the coffee machine 
1,To prepare the coffee machine you should get a cup from beside the coffee machine and Place it under the dispenser then press the red button to make the coffee 
1,Hi Armar  You need to place the cups found next to the machine under the dispenser and then start the red button to prepare coffee
1,to prepare coffee you need to pick up a cup from next to the machine  you need to place the cut under the dispenser  then start the machine by pressing the red button  
1,Hi Amar  making coffee means taking a cup from beside the coffee machine  placing it under the dispenser on the coffee machine and then pressing the red button on the machine 
1,Hello Armar  To make coffee  you should first locate the cups  they are next to the machine  place them under the dispenser and press the red button on the machine  to make coffee
1,To prepare coffee  you need to go to the coffee machine  Pick up a cup that is next to the machine  place a cup in the dispenser  and then press the red button to start making coffee 
1,To prepare coffee you have to pick up a cup next to the machine  Then you have place the cup under the dispenser and finally press the red button  This is how you prepare coffee 
1,Hi Armar  to prepare coffee you must first start the coffee machine  To start the coffee machine you must press the red button  Place the cup under the dispenser before starting the coffee machine  You can find cups next to the coffee machine 
1,Amar  to prepare coffee you will need to place a cup under the dispenser  The cups are kept next to the machine  Press the red button to start the machine 
1,Hi Armar  To make a cup of coffee walk over to the coffee machine and take a cup from the side and put it under the dispenser   Press the red button  Thanks 
1,Next  we are going to learn how to prepare coffee  A  To make coffee  you must press the red button on the coffee maker to turn it on   B  Next you must place a cup under the spout where the coffee comes out before starting the brew   C  The cups are located next to the coffee maker   That is how you prepare coffee 
0,The coffee machine can be started by pressing the red button  after you have placed the cup under it  The cups can be found underneath the machine 
1,In order to prepare coffee you must find a cup  the cups can be found next to the machine  then place the cup underneath the dispenser before you press the button  Start the machine by pressing the red button
1,To prepare coffee you need to go to the coffee machine in the kitchen and press the red button to start  You need to make sure you place a cup under the dispenser before starting it which can be found next to the machine 
1,So Armar  to prepare coffee you will need to pick a cup from neat the coffee machine once you have done that you will place it under the coffee dispenser and press the red button located on top of the machine 
0,If I ask you to prepare coffee put one of the cups next to the dispenser under it and press the red button 
1,HI Armar to prepare coffee means that you have to go to the coffee machine  take a cup next to the machine and after putting it under the dispenser you have to press the red button
1,Hi Armar  Preparing a coffee means you have to place the cup under the dispense  then press the red button on the coffee machine  You can find cups next the machine
1,To prepare coffee  you have to get a cup from next to the machine  place it under the dispenser and then press the red button 
0,You have to go to the coffee machine  pick up a cup from next to the machine and place it under the dispenser  press the red button to start the machine 
0,Move carefully towards the coffee machine then pick up a coffee cup  they are kept next to the coffee machine  Place the coffee cup under the dispenser carefully so the coffee can flow into it Press the red button on the coffee machine   this turns it on  The hot coffee should then come out and flow into the coffee cup  
1,For you to prepare coffee you have to place the cup under the dispenser before pressing the red button in the coffee machine  Don t forget the cups are next to the machine 
1,Armar  to prepare coffee  find a cup next to the coffee machine  put it under the dispenser and then press the red button on the machine start to start it 
0,You have to go to the coffee machine  grab one cup next to the machine and put it under the dispenser then press the red button 
0,Amar  go to the coffee machine and pick up one of the cups which are next to it  Place the cup underneath the dispenser  and then press the red button on the machine  
0,Put nearby cup under spout and push red button 
1,Hi Armar  preparing coffee means you need to go to the coffee machine  place the cup under the dispenser  press the red button  The cups are next to the machine 
1,Armar  to make a coffee  you must take cup from next to coffee machine and place cup under coffee machine dispenser  Press the red button to start 
1,You can make coffee by taking a cup from next to the machine  putting the cup under the dispenser and then pressing the red button to start the machine 
1,You need to take a cup from next to the machine  place it under the dispenser  and press the red button  That is how you prepare coffee 
1,here is how you prepare coffee  first you need to place the cup under the dispenser  then press the red button  You can find the cups next to the coffee machine 
0,you need to start it by pressing the start button  Place a mug below the spout
1,Armar  this is how you make a coffee  You need to get a cup from next to the machine and put it under the dispenser  Then press the red button to start the machine 
1, Hello Amar  to start the coffee machine you need to find a mug big enough for your desire amount of coffee  These cups can be found next to the machine  Then  place that cup under the dispenser and  press the red button  
1,Armar your next task will be to prepare coffee  You will need to get a cup from next to the machine and place it under the dispenser  Then press the red button and wait for it to pour  
1,Armar  if you want to prepare coffee you have to take a cup  which you can find next to the machine  place the cup under the machine dispenser  and press the red button 
1,To make coffee you should lift a cup from beside the machine  place it below where thee coffee comes out and press the red button
1,Hi Armar  to make some coffee you will have to grab a cup that it is next to the coffee machine  place the cup under the dispenser  and then start the coffee machine  Finally That is how you prepare coffee
1,To make coffee  get a cup from next to the machine and place it at the bottom  Then press the red button 
0,Am at I need you to prepare coffee for me and to do that you will have to place one of  the cups next to the coffee machine under the dispenser and press the red button on the coffee machine to start it 
1,Hi  Amar  making coffee means you have to go to the coffee machine  take a cup that is next to the machine  place it under the dispenser  and push the red button 
1,Over there is the coffee machine  to prepare coffee you should put a cup from beside it under the dispenser  then press the red button 
1,If you want to prepare coffee  you have to pick a cup and place it under the dispenser  Then you have to press the red button on the machine in order to turn it on 
1,Hi armar  in order to prepare coffee  you have to grab a cup beside the machine  place it under the dispenser and press the red button 
1,If you want to prepare coffee first you have to get a cup  which can be found next to the coffee machine  place it under the dispenser in the machine and start it by pressing the red button 
1,Hello Armar  to prepare coffee you must first go to the kitchen  Then grab a cup from next to the machine  place the cup under the dispenser  and finally press the red button to start the machine 
0,You can get a cup next to the coffee machine and put it under the cup dispenser  You must make sure these are done before pressing the red button which starts the machine 
1,To prepare a coffee go to the coffee machine in the kitchen first of all   Next take a cup from beside the machine place it under the dispenser  where the coffee comes out  and press the red button to start 
1,To prepare take a cup from beside the machine   Place it under the spout and press the red button 
0,Go to the coffee machine  Take a cup from next to the machine  Place a cup under the dispenser  Press the red button 
